{
  "id": "4788a7ec-00ee-11ed-b939-0242ac120002",
  "name": "Atlas",
  "brandGrade": "Premium",
  "parentBrandId": "",
  "internalOrganizationId": "",
  "auditInfo": {
    "createdDate": "2023-12-12T19:24:05Z",
    "createdBy": "Application Admin",
    "updatedDate": "2023-12-12T19:24:05Z",
    "updatedBy": "Application Admin",
    "isDeleted": true
  }
}